{
  "source_id": "D0000001",
  "source_revision": "2026-09-20T15:30:00+05:00",
  "deal_number": "BT-2609-001",
  "customer_code": "M0475",
  "customer_name": "Qodirov Rustam YaTT",
  "branch_code": "TOS",
  "stage": "Taklif yuborildi",
  "status": "won",
  "amount": "12500000.00",
  "currency": "UZS",
  "created_at": "2026-09-02T10:00:00+05:00",
  "closed_at": "2026-09-20T15:30:00+05:00",
  "channel": "Instagram"
}
